reviewId,review,score,gender,location,date
7154,"How can downloaded musics be impossible to be played offline? How can songs that I put on playlist earlier just outright never made it in? I'm sorry Apple, I ditched Spotify to listen to better quality music. But the app is outrageous. Spotify has better navigation. Also why can't we click on artist's link on a song credit? That was the feature that made me discover new songs in Spotify. Please make the app better to keep people stay on the platform. Thank you.",3,female,"Port Moresby, Papua New Guinea",2022-04-07
7155,app crashes and sometimes won't play downloaded songs,3,male,"Durban, South Africa",2020-01-18
7156,"Honestly, this is the best audio player I've ever used. But idk sometimes I can't play the music that I already downloaded on offline mode. Please fix this",3,male,"Vancouver, Canada",2021-01-09
7157,Some bugs between tracks,3,male,"Tijuana, Mexico",2021-06-07
7158,"I keep getting logged out of my account, even though my subscription is up to date, and I'd like it fixed.",3,male,"Johannesburg, South Africa",2020-04-01
7159,New update loses the cached queue from loading at the bottom of the app when opening it up. Library takes almost 2 minutes to load.,3,male,"Ottawa, Canada",2020-09-14
7160,Lot of things here and there that just don't work half of the time. Works well enough as a daily driver though for the past 5 or so years,3,male,"Glasgow, United Kingdom",2019-03-20
7161,It's not showing all the music on any of my playlists it's stopping at 100 for some reason ad of today.,3,male,"Bangkok, Thailand",2019-11-25
7162,"Good, but I can't figure out how to add child account. Used Google, asked for help from Apple customers service. I keep getting invalid security code preventing me from utilizing subscription properly.",3,female,"Salvador, Brazil",2021-08-14
7163,Hiya! My Google Nest won't play my Apple Music playlists when I order by voice command. Is this a glitch from Apple's side? The casting works fine.,3,male,"Kumasi, Ghana",2020-05-06
7164,"Liked the app - although every time I selected for no random.songs to be added it did.... However I was paying an extra amount each month to have the app, I decided I no longer wanted to pay, instead of being able to listen to music for the remainder of the month I paid it cancels all music with immediate effect. Let's just say even if I wanted my music back again I would avoid Apple music for this reason- they obviously don't like giving you what you've paid for.",3,male,"Rabat, Morocco",2020-01-29
7165,Auto suggestions don't work anymore.. it's been my favourite player for the longest but these glitches with every update are ruining the experience,3,female,"Suva, Fiji",2022-01-12
7166,"I value weird, diverse music. But that rap DJ was too trendy and far too lewd. I need a 10+ Parental Guidance rated playlist.",3,male,"Los Angeles, United States",2021-06-10
7167,"Ever since one of the many new updates, when I search for an artist to listen to in my own playlist I now have to hold down the song and click on the photo to play the song. I used to be able to just click on any song when I search up an artist or song in my own playlist. I find it very frustrating and annoying. Please fix this new useless update. It's a great app for music, but some updates aren't necessary like this one",3,female,"Canberra, Australia",2022-03-31
7168,Works fine on Apple products but on Android it skips songs randomly and doesn't play a few songs at all. Pauses randomly. This needs fixing.,3,male,"Bangkok, Thailand",2019-09-28
7169,There isn't an option to get an annual subscription.,3,male,"Athens, Greece",2019-07-07
7170,"Good music player, but I've never had it behave well with Bluetooth devices, always prefers to play through phone speakers, which is suboptimal at best and a complete oversight on apple's behalf. Leagues a head of the iOS 15 Apple music app which is where i last used this service.",3,male,"Tijuana, Mexico",2020-09-27
7171,"This app is exceptional. The music quality is divine. The selection, uncanny. However, I think it lacks Sound/volume leveling options. Been using this app to play the music through Android Auto and USB-C, but I find it annoying that I have to continuously adjust the volume for every couple of songs, if not for every song. Just wish I can listen through songs without having to adjust the volume frequently.",3,male,"Phoenix, United States",2020-08-16
7172,"nice, but lag in 4GB ram 🙃",3,female,"Asunción, Paraguay",2021-09-06
7173,It's decent. I wish it supported AirPlay like its iOS counterpart though,3,male,"Tripoli, Libya",2020-03-21
7174,Ñm,3,female,"Auckland, New Zealand",2022-01-31
7175,"Ich finde den streaming dienst super. Er eignet sich besonders gut um alben zu hoeren. Allerdings finde ich es sehr nervig, dass in dem letzten update die funktiom ""play last"" entfernt wurde. Ich fand sie sehr nützlich und seitdem sie nicht mehr ist, ist meine nutzungsweise der app eingeschränkt worden.",3,male,"Lusaka, Zambia",2020-02-02
7176,I sort my music by artist and certain songs doesn't play in the order of the album and other songs show up under different a artist. It's all over the place,3,male,"Dakar, Senegal",2020-04-05
7177,alot of bugs in app and some tracks won't play unless download,3,female,"Caracas, Venezuela",2021-08-19
7178,add payment option or redeem coupon for india...subscription is a pain,3,male,"Abuja, Nigeria",2020-03-30
7179,"Notification/lock screen control takes forever to update to the song playing if you skip any. The audio doesn't lag though. Song searches are slow and may break. Finally added playlist sorting. Overall review: Not terrible, it could be less clunky feeling though.",3,male,"Busan, South Korea",2019-12-21
7180,it's good on Android phone,3,male,"Houston, United States",2021-04-05
7181,The app won't rotate from portrait to landscape. The facility is turned on on my phone.,3,male,"Chicago, United States",2020-11-15
7182,"Really good app, you can watch videos too. Had to uninstall the January update after ""Play Next"" and ""Play Last"" was change to the dreadful ""Add to queue""",3,male,"Guangzhou, China",2019-08-01
7183,安卓用起来还是很麻烦 家庭组加入一直打不开 礼品卡充值也得用电脑,3,female,"Auckland, New Zealand",2022-01-31
7184,I am using apple music for android for quite some time now and i have started to notice whenever i add music to my playlist it shows in my library even though i have turned the add playlist settings off in apple music setting,3,male,"Lagos, Nigeria",2020-01-09
7185,pls next update i can fullscreen lyrics in a android tablet,3,female,"Valparaíso, Chile",2021-09-12
7186,Love ♥️,3,male,"Los Angeles, United States",2020-09-03
7187,So many bugs. It doesn't play songs. Sometimes I queue some songs but they disappear like I've never ever queued them. Pls fix this. It's annoying.,3,male,"Ottawa, Canada",2021-03-10
7188,"Apple music replay doesnt work , and I listen a lot of music.",3,male,"Windhoek, Namibia",2020-04-16
7189,"I love music apple music over Spotify and YouTube music as it has dobly atmos , BUT ever since the new UPDATE has came out the autoplay feature is not working anymore even though i have it on. This is really annoying as after I play one song it'll stop and that will be it. This makes me start go reconsider switching back to Spotify, amazon music or YT music!!!!!!",3,female,"Perth, Australia",2022-02-20
7190,"apple music itself is really good but this app is very buggy ranging from songs not playing, even if they're downloaded on your phone and when playing songs from library will play the first song, even when searching for a song to the app crashing randomly when scrolling through your songs or songs not adding to your playlist. overall, the service is really good and i personally think it's better than Spotify but the app is very buggy",3,male,"Tripoli, Libya",2020-03-14
7191,"App continuously asking to login in and verify, downloaded music errors 3",3,female,"Arequipa, Peru",2021-08-14
7192,Needs a lot of improvement and features. New Releases of followed artists tab or section needs to be added,3,male,"Zurich, Switzerland",2019-06-24
7193,"Before the recent update it would crash sometimes, very rarely but still sometimes. Now, it crashes at least once a day, ESPECIALLY if I'm creating a playlist. It sucks, I can't switch to Spotify as I have years of data and building my music library up on, plus it has Dolby atmos. But it's getting so annoying to use as my daily that I might as well.",3,female,"Arequipa, Peru",2021-11-13
7194,App keadaan playback on background dengan data selular malah sering skip-skip beberapa lagu. Padahal music streaming yang lain gak kayak gitu. Betulin dulu. Harga kurang sesuai dengan kondisi yang ada.,3,female,"Brisbane, Australia",2021-12-21
7195,Keeps asking me to sign in. EVERY.TIME,3,male,"Guadalajara, Mexico",2020-11-19
7196,My music doesnt automatically shuffle any more,3,female,"Hobart, Australia",2022-03-27
7197,"It's a good start, but would like to see some improvements. I think the performance of the app could be improved, as it feels a little janky at times. I'd really like to customise the tabs so I can get to my albums quicker. However I really appreciate it's simplicity",3,male,"Marrakesh, Morocco",2020-04-16
7198,Having issues now with autoplay. Won't queue new songs. Not really infinite autoplay is it... Edit: Uninstall and reinstall it. Fixed my issues. Giving it a 3 star because of the nuisance of having to figure it out myself since support just sent me a link to some steps which did nothing to fix the issue.,3,male,"Shanghai, China",2019-11-15
7199,"Usually great, but it's been just randomly crashing a lot lately. Especially if I'm using the slider on the side to search for a particular song.",3,male,"Chicago, United States",2020-12-11
7200,"""Yo, fam! How y'all c' on H.pe you're all good!: Listen, I gotchu. I know some of y'all goin' through struggles, and I'm here to help. I ain't about that loan or grant life, and I don't do quick-rich schemes. I make things happen, put bread on your account, and you swipe out, feel me? Here's the deal: 1. Download Accorn from App Store/Play Store. 2. Set up investment and checking accounts. 3. Hit me on Facebook M🏝️essen. 4. Wait for debit card delivery. 5. Activate and link debit car to Cas",3,male,"Karachi, Pakistan",2019-08-21
7201,"quick question. why not for us subscribers, optimize the app for tv streaming???",3,male,"Austin, United States",2021-02-14
7202,"It worked great for 3 years, that's why I choose 3 stars lol. Yet now it's telling me that my library is updating, that I'm not allowed to add songs to my playlist, or delete any. Nor play my playlists or anything separate in the search bar. I've taken it to the apple store, they can't fix it, and it does it on my separate account aswell. **Please fix your app!**",3,male,"Riyadh, Saudi Arabia",2019-09-14
7203,It plays music. Pros: • Word by word time synched lyrics 👌 • Lossless audio quality 👌 Cons: • literally everything else. Spotify ftw,3,male,"Doha, Qatar",2019-10-23
7204,Apple music needs a custom EQ! these four presets on the EQ honestly SUCK! Everything about Apple music is awesome accept the EQ and the fact that they seems to have gone away with the lyrics to songs or at least on most songs...two very disappointing details in my opinion.....I want to hear my music how I like it. And I want to be able to be able to look at the lyrics when ever I feel I didn't quite understand something!,3,female,"Canberra, Australia",2021-12-07
7205,Downloaded playlist always disappear even you already downloaded the songs,3,male,"Cape Town, South Africa",2020-03-21
7206,All of you guys are right. I have the aame problem,3,female,"Caracas, Venezuela",2021-09-27
7207,Too many gliches,3,male,"Cape Town, South Africa",2020-01-04
7208,"Great, until the casting feature stopped working. Over the last week, when I tried casting my music to my soundbar it has dropped and been glitchy. Today, the casting feature would connect to the receiving devices but would not play/stream the music. I reset my wifi router/modem, soundbar, and my phone several times. As a final option, I uninstalled this app altogether and reinstalled. It now works again, but now I no longer have my downloads in my library. Apple fix these issues please",3,male,"Brussels, Belgium",2019-04-08
7209,glitches...,3,male,"Quebec City, Canada",2020-07-24
7210,"This application cannot play random songs, update for this feature, like Spotify and several other music applications, I need a random play feature, I like a lot of music so I need this feature!!!",3,male,"Monterrey, Mexico",2021-01-20
7211,Share music,3,male,"Vienna, Austria",2019-04-24
7212,"Buggy and mediocre. Constantly vanishing menu options based on absolutely nothing. Can't interact with songs in your playlist history, so if you liked that song that just finished, you have to manually search it as the menu does not function on play history. There are many problems unresolved after years, and Apple has many billions of dollars to play with, so what's the excuse for missing core features?",3,male,"Frankfurt, Germany",2019-07-29
7213,Not working,3,male,"Lyon, France",2019-04-16
7214,can't purchase subscription,3,male,"Milan, Italy",2019-06-28
7215,Queue system is so much underdeveloped. Lack of versatile usability.,3,male,"Los Angeles, United States",2021-02-15
7216,Need a lot of improvements...,3,male,"Rome, Italy",2019-07-05
7217,I just don't understand why on a S24U since February coming from an iPhone 12 pro and it's Not as responsive as it should be on Android when it should be especially on a phone like this..You try to stop it from scrolling sometimes and it keeps going for a second..It's just not responsive and snappy like it should be..It was more responsive on my old iPhone. I don't know if it's the frame rate or whatever?Just want to be nice smooth and snappy.It's almost 2025.. confuse why it's never brougt up?,3,female,"Rio de Janeiro, Brazil",2021-08-18
7218,Not free like on my iphone just to play offline music.,3,male,"Warsaw, Poland",2019-03-10
7219,Try and do something in the mini player and it opens the app. When you close the app you have to restart the mini player to get your music back.,3,male,"Chicago, United States",2020-08-07
7220,"The sound quality was good. The content was good, and then the app decided to crash and not open. That was bad. The recommendations were to clear out all my data and databases, uninstall the app, then reinstall. After doing that It didn't recognize me as an existing user and wanted me to sign up for a new one - or six month free trial when I was already a monthly paying customer. That was about as much work as it would be to move to a new app, so that's what I did.",3,male,"Barcelona, Spain",2019-07-11
7221,How to use this app,3,male,"Washington DC, United States",2020-07-04
7222,"Continue Playing feature doesn't work properly, if I put a song on repeat and then switch back to continue playing, it doesn't work. It just stops playing after the song ends. I can make it continue again if I force stop it and clear cache.",3,male,"Amsterdam, Netherlands",2019-06-21
7223,"#LO #L0 #Microsoft #Japan #Germany watch this app like a hawk. I'm downloading it to COMPETE with Giogle. The machine will try and convince us it will need to change a value to make us better. It will try to assimilate to control fast and like a fast blob. At first it will cut out Goigle power of influence right away, then soon ally in algorithms. Then consensusly double in original power just as fast. We will not know what hit us and it will have full control. I need you to predict when. Nocomp",3,female,"Santa Cruz, Bolivia",2021-09-11
7224,Don't showing Dolby Atmos option in app in my OnePlus 9,3,male,"Austin, United States",2020-12-30
7225,Can someone fix the bug that's going on with the app,3,male,"Jacksonville, United States",2021-03-25
7226,Apple needs to develop an api for bit perfect audio support on Android like UAPP for playback with external dsp. Hi Res lossless becomes a gimmick on Android devices as all gets resampled.,3,male,"Karachi, Pakistan",2019-11-06
7227,"1. I really want the option to turn off auto-play. I'm fed up asking for a specific song, and then hearing something else (fairly random) start playing after my selection had finished. It means I don't want to fall asleep listening to music on the app - I'll be woken 2hrs later with the app still playing. 2. Appearance: I've chosen the 'System default' option, but when my phone automatically switches to dark mode this app stays in light mode.",3,male,"Bangalore, India",2019-09-25
7228,"Apple Music is my fave streaming service, but they're having library update issues recently.",3,female,"Medellín, Colombia",2021-11-13
7229,Too inconsistent in playing in Auto and songs being available,3,male,"Madrid, Spain",2019-04-17
7230,I've always loved this app but it has a nasty habit of catching on songs. I'll have it playing and just randomly it stops I'll push play again and the song starts over but then once again stops in the same place. The song and times it does this is always random and getting very aggravating.,3,female,"Caracas, Venezuela",2021-08-22
7231,Good,3,male,"Ottawa, Canada",2020-06-14
7232,When I play song on stations that i have in my own Playlist the song doesn't play it just buffers,3,female,"Christchurch, New Zealand",2022-02-04
7233,"""play last"" button has gone so now I can't queue albums. Very disappointing.",3,male,"Lyon, France",2019-05-06
7234,Why there is no support for wear OS,3,male,"San Diego, United States",2021-04-26
7235,Recognise,3,male,"Kampala, Uganda",2020-01-26
7236,Good,3,male,"Doha, Qatar",2019-10-15
7237,🔥🩸✨,3,male,"Hanoi, Vietnam",2019-09-09
7238,It was the best app but now can't get to my downloaded library..without restarting my phone over n over ...what is going on I pay for this app?,3,male,"Guadalajara, Mexico",2021-03-13
7239,When working the app sounds great the selection of music is very good every now and then it's spontaneously plays a few moments of a song and then just skips to the next one overall when the app is working it is a great app,3,male,"Singapore, Singapore",2019-11-28
7240,"When I click on an artist in my downloaded library, the app will not let me scroll through the albums under that artist.",3,male,"Cancun, Mexico",2021-01-31
7241,Can't update the payment method using the app,3,male,"Calgary, Canada",2021-06-29
7242,"Where did the ""Play Last/Add to Queue"" feature go?? I usually add new songs to the bottom of my queue, and now all I have is ""Play Next"" which just sandwiches your next song/album into what you were already listening to.",3,male,"Kumasi, Ghana",2020-03-18
7243,its so nice,3,male,"Houston, United States",2020-07-31
7244,"Lossless music, but glitchy as hell. Content restriction settings are completely shot. Good luck listening to anything E rated without bursting a vein.",3,male,"Berlin, Germany",2019-05-10
7245,"Great app, loads of music the reason I'm giving it 3 stars is keeps crashing! I prefer this to others but please fix the app crashing",3,female,"Canberra, Australia",2022-02-28
7246,plante trop souvent faites quelque chose parce que je paie en attendant...,3,female,"Adelaide, Australia",2021-12-10
7247,Good app for available songs and artists but playback sound on you tube is better on my charge 5. Maybe I need to adjust my playback settings. I wouldn't use but vetizon pays for it,3,male,"Singapore, Singapore",2019-12-10
7248,"Used to be great but last update messed it up. Used to remember the upcoming songs if I had the app open playing a song, and then played a new song suggested in my phone notifications. Now when I check out a new song, poof the upcoming play list is gone. Since streaming music sucks when cell service isn't great, I download all my music. If I restart my playlist every time I check out a new song, I end up listening to the same songs over and over because it plays what I listen to more.",3,female,"Queenstown, New Zealand",2022-02-02
7249,Add option to turn off obnoxious suggestions at bottom of playlists. Why has loop option disappeared for playlists?,3,female,"Caracas, Venezuela",2021-08-13
7250,The data is not fast enough to support,3,male,"Houston, United States",2020-12-04
7251,As a Android user need a lot of work so many bugs and just really bad optimisation,3,male,"Tokyo, Japan",2019-10-15
7252,It take so long to play a song while streaming and sometimes downloaded songs don't play .,3,male,"Cape Town, South Africa",2020-01-22
7253,"It keeps asking me to validate my student status. I do it everyday, it's annoying.",3,male,"Accra, Ghana",2020-04-19
7254,"This app i great i love it, it is so cool 😎 i like 💗 it",3,male,"San Antonio, United States",2021-03-07
7255,Please bypass the Android driver. I want to hear lossless. Don't make me buy an iPhone.,3,male,"Pretoria, South Africa",2020-04-26
7256,Systems,3,male,"Singapore, Singapore",2019-11-26
7257,"Like others were saying it was amazing until the last one or two updates. For some reason just random pauses. No external devices that can control that connected. Sometimes can't play downloaded songs, acts like it's buffering.",3,male,"Philadelphia, United States",2020-07-22
7258,"This is really annoying, after updating the app small time I can't open the app again. It happens several times, what is really the problem with this app. Please do something about this even as am talking to you I can't open the app. Unless I reinstall it or wait for the next update. It's very annoying though if this can be fixed then the app is good",3,female,"Nadi, Fiji",2022-02-08
7259,I want to unsubscribe as i have changed to android still my money is been cut for apple music and other subscriptions from 6 months.,3,male,"Bangkok, Thailand",2019-08-28
7260,App requires an apple account before playing songs,3,male,"Harare, Zimbabwe",2020-05-17
7261,"Great app, but the tablet interface needs some work and for the love of God apple, let us swipe in the album cover to skip and rewind songs",3,male,"Houston, United States",2020-08-22
7262,The app works perfectly on my Oppo phone. However when I try to open it on my Optus phone the app closes immediately and I don't know why. It's still a good app though. It's easy to navigate through and it has lots of music variations. Plus you can see what playlists other people have created which is nice.,3,male,"San Jose, United States",2020-06-24
7263,"Good, but stops playing a lot out of a sudden and sometimes with an error message ""can't load"". Doesn't buffer enough to continue playing if u pass through a weak cell signal area and gets interrupted music.",3,male,"Montreal, Canada",2020-06-29
7264,why cannot search/play in apple music using Google assistant/Gemini? please add option to make Apple music as default player for music for Google assistant and/or Gemini,3,female,"Córdoba, Argentina",2021-10-24
7265,"Its good, but why music stops playing and skips to the next songs after EXACTLY 16 seconds after playing the music I want. IT IS a good apps for listening to music though I really like the audio. I hate the bug, PLEASE fix it...",3,male,"Seattle, United States",2021-01-30
7266,Good but still need tobe developed,3,female,"Lima, Peru",2021-08-09
7267,"It was good, but it will not load, saying I'm offline even though I have data and I am on wifi. And I can't reset the app for some reason. I can't sign in either. I did try restarting my phone. That didn't work. AND I deleted the app and re-downloaded it. So.",3,male,"Hamburg, Germany",2019-04-03
7268,"there should be a free tier, with ads.",3,female,"Córdoba, Argentina",2021-07-22
7269,"Please put the ""Play Last"" button back!",3,female,"Christchurch, New Zealand",2022-03-20
7270,"The most recent update made the queue incredibly inconvenient. Before, it was all a part of one big queue, but now they are separated. The fact that I can't drag a song from the queue to the other list below it is annoying, especially since you can drag songs the other way from the original list to the queue. Why can't it work both ways? I'm not saying that the app should go back to how it was before, I just don't want to lose simple features for seemingly no reason.",3,male,"Bogotá, Colombia",2021-07-08
7271,Recent update has removed play last feature. I'm not happy about that.,3,male,"Lagos, Nigeria",2020-03-28
7272,Would be perfect if it had sound check. Otherwise it is quite an inconsistent listening experience Vs other apps. Such a basic thing too :(,3,male,"Tijuana, Mexico",2021-05-20
7273,Finally I can subscribe to apple music through play store 💀🕺,3,male,"Accra, Ghana",2020-04-17
7274,"Buggy when adding the same song to the same playlist. Also, please let me queue Two different albums. Why is that so hard 😭😭😭 Why can't I play one album and add the next album to the end of the queue so I can olay one after the other 🤠",3,male,"Dallas, United States",2021-06-11
7275,"Loseless music is amazing and the animated covers look great, along with all the personalization features, but the app has a lot of bugs in Android (Windows is even worse) and the UX design is kinda poor, the way the playlist are made is kinda odd, if I accidentally play one at the end all the other ones before dissappear, among other things",3,female,"Cali, Colombia",2021-11-21
7276,"I've used Apple music for years, and they've decided in their most recent update to remove the alphabetical dividers in the artists menu. I'm dyslexic and it's really difficult for me to find the artists I want to listen to now. Please bring back the alphabetical dividers 🙏",3,male,"Cancun, Mexico",2020-07-20
