review,sentiment,Polaridad_Clustering,Topic_ID,Palabras_Clave,location,gender,date
Great new artist every month Excellent new albums released,positivo,positivo,0,"time, android, update, platforms, problems, offline, audio, sweet, galaxy, rate","Beijing, China",male,2016-02-09
"Honestly way better than Spotify. I'm not an Apple user, but I switched to Apple Music when looking for a cheaper alternative to Spotify and I love it. The music quality is so much better and the app is still easy to use.",positivo,positivo,1,"devices, interface, syncs, clean, mixes, suggestions, user, personalized, android, enjoyable","Cancun, Mexico",male,2016-12-09
Is not doubt one the complete music platform,positivo,positivo,5,"platform, algorithm, didnt, service, clear, podcasts, issue, android, choice, audio","Vancouver, Canada",female,2017-09-25
At the moment it's breaking in and out,positivo,positivo,3,"search, specific, problem, download, option, phone, bugs, trial, edit, pixel","Cape Town, South Africa",male,2016-07-22
Apple music is the best I tried the others not the same but the other music apps are good second options,positivo,positivo,2,"audio, lossless, atmos, dolby, lyrics, options, hires, feature, india, spatial","Canberra, Australia",female,2018-07-17
"Is the first time I use kind of this app , I want to know about it, if it is good I will use it for along time , thank you very much for giving me a chance to express my self",positivo,positivo,5,"platform, algorithm, didnt, service, clear, podcasts, issue, android, choice, audio","Dallas, United States",male,2017-04-08
The app is still slow and needs a lot of improvement. Not quite responsive.,positivo,positivo,1,"devices, interface, syncs, clean, mixes, suggestions, user, personalized, android, enjoyable","Toronto, Canada",male,2017-04-01
NADA ES GRATIS EN ESTA VIDA TODO REQUIERE ESFUERZO PERO LO QUE SE HACE EN FE AMOR Y SOBRE TODO AMOR Y DOMINIO PROPIOS DE TUS CAPACIDADES PARA SERVIR NUNCA CREERTE MAS QUE NADIE PORQUE SI TE CREES MAS QUIZA AEAS O EL MOTIVADOR O EL MOTIVADOO NO INTERESA EL PAPEL ES EL EFECTO,positivo,positivo,6,"phone, account, android, selection, samsung, product, smooth, products, video, recommendation","Guayaquil, Ecuador",female,2018-01-31
"I'm a samsung user previously an iphone user, but I love apple music and didn't want to lose it when I switched to android. I don't use anything else.",positivo,positivo,1,"devices, interface, syncs, clean, mixes, suggestions, user, personalized, android, enjoyable","Krakow, Poland",male,2015-10-10
Very good app. No ads. The only thing I would like is better playlist sharing. Car play is very good too.,positivo,positivo,0,"time, android, update, platforms, problems, offline, audio, sweet, galaxy, rate","Córdoba, Argentina",female,2018-01-30
"Its working as it should be. Something wried going on every android device that I have, When I play music the audio a second pauses and continuous",positivo,positivo,5,"platform, algorithm, didnt, service, clear, podcasts, issue, android, choice, audio","Boston, United States",female,2017-09-06
"Da iTunes, Nothing does it better. You know what they say! IF IT'S TOO LOUD............. YOUR TOO OLD!",positivo,positivo,6,"phone, account, android, selection, samsung, product, smooth, products, video, recommendation","Perth, Australia",female,2018-06-11
Prompt and very swiftly. Searches very quick and fast.very easy,positivo,positivo,6,"phone, account, android, selection, samsung, product, smooth, products, video, recommendation","Tijuana, Mexico",female,2017-08-20
Love it. Just love it. You should download it if u see this comment (:,positivo,positivo,3,"search, specific, problem, download, option, phone, bugs, trial, edit, pixel","Barcelona, Spain",male,2015-08-20
"Best App so,. I love the Apple music so much",positivo,positivo,0,"time, android, update, platforms, problems, offline, audio, sweet, galaxy, rate","Buenos Aires, Argentina",female,2018-02-08
Worth the money spent because of how clean the music sounds.,positivo,positivo,0,"time, android, update, platforms, problems, offline, audio, sweet, galaxy, rate","Tunis, Tunisia",male,2016-06-03
The best they just need to improve their auto playlist from create station,positivo,positivo,1,"devices, interface, syncs, clean, mixes, suggestions, user, personalized, android, enjoyable","Wellington, New Zealand",female,2018-04-28
"Apple Music adalah aplikasi streaming musik terbaik menurut saya, kualitas audio yg diberikan sangat bagus, dan library musik yang cukup lengkap.",positivo,positivo,4,"android, curated, powerful, voice, commands, stable, regular, service, player, device","Montreal, Canada",male,2017-02-26
best sound quality 100000000 times better than spotify,positivo,positivo,0,"time, android, update, platforms, problems, offline, audio, sweet, galaxy, rate","Buenos Aires, Argentina",female,2018-02-07
"All song's has it's best sound quality, So love to hear in earphones. Video quality also great,,",positivo,positivo,0,"time, android, update, platforms, problems, offline, audio, sweet, galaxy, rate","Cali, Colombia",female,2018-02-22
download or copied cd to music to listen,positivo,positivo,3,"search, specific, problem, download, option, phone, bugs, trial, edit, pixel","Jacksonville, United States",male,2017-07-08
Absolutely wonderful to be able to hear music anywhere.,positivo,positivo,0,"time, android, update, platforms, problems, offline, audio, sweet, galaxy, rate","Barcelona, Spain",male,2015-10-05
good but wont play from phone to car,positivo,positivo,6,"phone, account, android, selection, samsung, product, smooth, products, video, recommendation","Jeddah, Saudi Arabia",male,2016-01-15
"What a beautiful application. I love it. Also, i noticed that Apple Music and Hulu applications are different from applications like Amazon Music and Pandora. I think that Apple Music is native to ChromeOS same with Hulu. Application's like Amazon Music or Pandora still transitioning from Android OS to ChromeOS, just a thought.",positivo,positivo,3,"search, specific, problem, download, option, phone, bugs, trial, edit, pixel","Stockholm, Sweden",male,2015-07-01
"One of the best ever, only wish the could supply through all platforms!!",positivo,positivo,0,"time, android, update, platforms, problems, offline, audio, sweet, galaxy, rate","Wellington, New Zealand",female,2018-08-02
I have tried many music apps Apple is number 1.,positivo,positivo,0,"time, android, update, platforms, problems, offline, audio, sweet, galaxy, rate","Perth, Australia",female,2018-08-12
"the ui could be a bit better, but apple music of THE BEST if you listen to hi res lossless music.",positivo,positivo,2,"audio, lossless, atmos, dolby, lyrics, options, hires, feature, india, spatial","San Diego, United States",female,2017-09-05
"I think you should totally listen to for King&Country. Why? Well, first, all of their music is clean and Christian. Second, they are a hip-hop Christian band, so you'll have lots of fun with their songs. Thanks!",positivo,positivo,5,"platform, algorithm, didnt, service, clear, podcasts, issue, android, choice, audio","Brisbane, Australia",female,2018-05-15
The only thing Apple's ever done that I like.,positivo,positivo,0,"time, android, update, platforms, problems, offline, audio, sweet, galaxy, rate","Chicago, United States",male,2017-07-28
Love Apple music's availability on multiple platforms including on my PS5. Nice integration.,positivo,positivo,5,"platform, algorithm, didnt, service, clear, podcasts, issue, android, choice, audio","Boston, United States",male,2017-03-11
It is a very amazing music platform. The sound is so clear that I spend all my time on this app.,positivo,positivo,5,"platform, algorithm, didnt, service, clear, podcasts, issue, android, choice, audio","Hong Kong, China",male,2016-02-12
"High quality (Hifi) sound that doesn't glitch. Dear tidal, YouTube, and amazon, take note. If Spotify had a high quality option I wouldn't be typing right now. But here I am.",positivo,positivo,5,"platform, algorithm, didnt, service, clear, podcasts, issue, android, choice, audio","Johannesburg, South Africa",male,2016-06-05
lets just say ... still on my samsung a23 i have my apple music.,positivo,positivo,1,"devices, interface, syncs, clean, mixes, suggestions, user, personalized, android, enjoyable","Lusaka, Zambia",male,2016-07-22
It's a good place for music. I like that it let's me listen lossless audio in all my device. And has all songs I want.,positivo,positivo,2,"audio, lossless, atmos, dolby, lyrics, options, hires, feature, india, spatial","Calgary, Canada",male,2016-09-29
This app is beyond awesome. There hasn't been a song yet that I wanted to listen to that I haven't found. I truly love having the ability to create my own station. Awesome!!!!!,positivo,positivo,3,"search, specific, problem, download, option, phone, bugs, trial, edit, pixel","Mumbai, India",male,2015-12-01
"Got to have your jams , less talk more music! Idk bout yours but Our local radio has wayyyy too many commercials, so, to Apple Music I go, getcha some baby!",positivo,positivo,6,"phone, account, android, selection, samsung, product, smooth, products, video, recommendation","Valencia, Spain",male,2015-11-15
"Apple and 2022 worthy application as much as the service. Impeccable! Update: And in 2024 it is even more the defacto musoc application for Android too! It wipes the floor with every other service and player! Every feature, sound quality, UI, UX...are all perfect. Equal to its iPhone counterpart.",positivo,positivo,4,"android, curated, powerful, voice, commands, stable, regular, service, player, device","Lagos, Nigeria",male,2016-06-04
Target offers 2 months of apple music for free,positivo,positivo,0,"time, android, update, platforms, problems, offline, audio, sweet, galaxy, rate","San Francisco, United States",male,2017-05-21
I love apple music. The monthly fee is doable with no ads interrupting the music flow. I like that this option is available for other phone devices. Please don't raise your prices. Thank you for being Amazing!,positivo,positivo,1,"devices, interface, syncs, clean, mixes, suggestions, user, personalized, android, enjoyable","Sydney, Australia",female,2018-07-24
One of my favorite options on this app has been removed and I would love it if it's restored. The option to 'play last'. We're now left with only 'play next'. I can't queue songs to play last after a now-playing album. Please bring back 'Play Last'.,positivo,positivo,2,"audio, lossless, atmos, dolby, lyrics, options, hires, feature, india, spatial","Dakar, Senegal",male,2016-06-27
She is the full package!! Her delivery penetrates through every cell of your body!!! I know it's coming upon winter but I literally got chills from her. peace,positivo,positivo,4,"android, curated, powerful, voice, commands, stable, regular, service, player, device","Frankfurt, Germany",male,2015-11-12
Apple music on Android is definitely better then ios version better it has sleep timer and I really think that's Important to me so 10 out of 10,positivo,positivo,4,"android, curated, powerful, voice, commands, stable, regular, service, player, device","San Jose, United States",female,2017-10-10
Wuuheh good app for all of Apple phone's I never got,positivo,positivo,6,"phone, account, android, selection, samsung, product, smooth, products, video, recommendation","Adelaide, Australia",female,2018-08-11
First time user but I think I'll like it.,positivo,positivo,1,"devices, interface, syncs, clean, mixes, suggestions, user, personalized, android, enjoyable","Cancun, Mexico",female,2017-10-11
"Sooooo many glitches, constantly stops playing music and crashes, album artwork doesn't show a lot of the time too",positivo,positivo,6,"phone, account, android, selection, samsung, product, smooth, products, video, recommendation","Oslo, Norway",male,2015-08-15
I just love this app but I miss I chud listen to my glass cannon podcast on here,positivo,positivo,6,"phone, account, android, selection, samsung, product, smooth, products, video, recommendation","San Jose, United States",male,2017-03-09
I always like to hear music all time,positivo,positivo,0,"time, android, update, platforms, problems, offline, audio, sweet, galaxy, rate","Sydney, Australia",female,2018-04-06
"Best music streaming of all!!!! Love you, apple music!!!",positivo,positivo,0,"time, android, update, platforms, problems, offline, audio, sweet, galaxy, rate","Shanghai, China",male,2015-12-01
F e wf egg e e egg eregg dj s23 d3 dej e redde r3 e e e de e 22f33 gtse e d,positivo,positivo,0,"time, android, update, platforms, problems, offline, audio, sweet, galaxy, rate","Cancun, Mexico",male,2017-04-14
"apple music sounds way better than everything else. And the only way TIDAL Ever sounds good is if I'm playing it through USB audio Pro other than that there's no other music app that's in the same ballpark 2 words. LOSSLESS AUDIO. Apple Music blows the rest of these apps out the mf water. They are so far ahead of the game on everyone else, and I don't even own a single apple product. This puppy goes hard.",positivo,positivo,2,"audio, lossless, atmos, dolby, lyrics, options, hires, feature, india, spatial","Cancun, Mexico",male,2017-06-16
"I love the the app most, all the time.",positivo,positivo,0,"time, android, update, platforms, problems, offline, audio, sweet, galaxy, rate","Queenstown, New Zealand",female,2018-07-24
Great user interface. Allows use of Apple ID sign in on android device.,positivo,positivo,1,"devices, interface, syncs, clean, mixes, suggestions, user, personalized, android, enjoyable","Algiers, Algeria",male,2016-04-28
"Have it on ZenFone 9 - Android 13 and it's perfect. UI is beautiful, UX is intuitive, recommendations are good, animations are smooth and beautiful and sound quality is insane",positivo,positivo,6,"phone, account, android, selection, samsung, product, smooth, products, video, recommendation","Los Angeles, United States",male,2017-01-14
Provides all genres and lyrics. For the eclectic music listener it is wonderful. Provides other new artists or artists in genre to expand knowledge.,positivo,positivo,2,"audio, lossless, atmos, dolby, lyrics, options, hires, feature, india, spatial","Bangalore, India",male,2016-01-02
music just plays so smooth on my galaxy fold 4 compared to any other music app such as Spotify or Amazon music etc,positivo,positivo,0,"time, android, update, platforms, problems, offline, audio, sweet, galaxy, rate","Bangalore, India",male,2016-03-15
Amazing except for the fact that it has apple security settings. Worth the subscription,positivo,positivo,6,"phone, account, android, selection, samsung, product, smooth, products, video, recommendation","Shanghai, China",male,2016-03-12
sbb se mast app hai music streaming ka,positivo,positivo,0,"time, android, update, platforms, problems, offline, audio, sweet, galaxy, rate","Dublin, Ireland",male,2015-07-18
Doing another review cause I now only have minimal to zero issue. I prefer this app cause I enjoyed listening to lossless music,positivo,positivo,5,"platform, algorithm, didnt, service, clear, podcasts, issue, android, choice, audio","Vancouver, Canada",male,2017-03-26
It's amazing fell in love with apple music.,positivo,positivo,0,"time, android, update, platforms, problems, offline, audio, sweet, galaxy, rate","Rome, Italy",male,2015-09-03
One of the few non iOS apps Apple puts love into. Works very well!,positivo,positivo,0,"time, android, update, platforms, problems, offline, audio, sweet, galaxy, rate","Milan, Italy",male,2015-09-03
Selects music for you from the music that you listen to to make you a playlist,positivo,positivo,0,"time, android, update, platforms, problems, offline, audio, sweet, galaxy, rate","Guadalajara, Mexico",male,2017-03-10
"Great app, used it for a while, but now I can't reverify my student status (tries to open Unidays app then comes up with error message). Because of this I was moved to an individual plan without knowing, so I've cancelled it for now. I'd like to keep using it but if I can't reverify my student status in app is there any other way please? Thanks.",positivo,positivo,1,"devices, interface, syncs, clean, mixes, suggestions, user, personalized, android, enjoyable","Monterrey, Mexico",female,2017-09-29
Best music ever I could listen to this all day Even my kids like this app,positivo,positivo,1,"devices, interface, syncs, clean, mixes, suggestions, user, personalized, android, enjoyable","Quebec City, Canada",female,2017-09-20
"I use AM primarily because of the lossless. However, after the recent update, I've started having this issue where I'm unable to turn off restrictions. The password window bugs out, and the keyboard doesn't show up to enter password to turn off restrictions leaving me unable to listen to the majority of songs in my Playlist. Device: samsung s23 ultra, software is up to date. Edit: it's fixed now, thank you!",positivo,positivo,0,"time, android, update, platforms, problems, offline, audio, sweet, galaxy, rate","Accra, Ghana",male,2016-06-14
Music selection is good. But cast does not work somwtimes,positivo,positivo,6,"phone, account, android, selection, samsung, product, smooth, products, video, recommendation","La Paz, Bolivia",female,2018-03-01
Good and varied playlist. Switched for Hi res audio and for new songs discovering. YT and other music apps tend to be repetitive in their song playlist,positivo,positivo,0,"time, android, update, platforms, problems, offline, audio, sweet, galaxy, rate","San Diego, United States",male,2016-12-10
"dis was uitstekend , asb maak di layout beter asb!!!",positivo,positivo,0,"time, android, update, platforms, problems, offline, audio, sweet, galaxy, rate","Córdoba, Argentina",female,2017-12-09
"I absolutely love the music selection! So many songs that I thought wouldn't be on here, were!",positivo,positivo,6,"phone, account, android, selection, samsung, product, smooth, products, video, recommendation","Houston, United States",male,2017-03-13
wipes the floor with Spotify as it has lossless audio,positivo,positivo,1,"devices, interface, syncs, clean, mixes, suggestions, user, personalized, android, enjoyable","Tripoli, Libya",male,2016-07-13
I love it. I never switched to Spotify so apple knows my music taste well.,positivo,positivo,3,"search, specific, problem, download, option, phone, bugs, trial, edit, pixel","Geneva, Switzerland",male,2015-10-07
There's nothing better than to have apple music on your phone then you always have your music with you,positivo,positivo,6,"phone, account, android, selection, samsung, product, smooth, products, video, recommendation","Perth, Australia",female,2018-05-17
"I love to listen to music on this app even if I have to pay for it, no commercials at all",positivo,positivo,0,"time, android, update, platforms, problems, offline, audio, sweet, galaxy, rate","Addis Ababa, Ethiopia",male,2016-07-25
"I still have some deep cuts that Apple music can't bring to me, but it does a pretty good job across the board. I don't buy as many CDs and I don't have to carry around my 200 CD case, but I do need to have my stereo have Bluetooth now. Technology...",positivo,positivo,1,"devices, interface, syncs, clean, mixes, suggestions, user, personalized, android, enjoyable","Montreal, Canada",male,2017-01-23
apple provide more better quality songs. then android apple have best ecosystem,positivo,positivo,0,"time, android, update, platforms, problems, offline, audio, sweet, galaxy, rate","Tunis, Tunisia",male,2016-06-19
Apple Music is the best music streaming service!,positivo,positivo,4,"android, curated, powerful, voice, commands, stable, regular, service, player, device","Monterrey, Mexico",male,2017-01-29
Bangs well when you listen to wizkid songs. #morayo the album,positivo,positivo,0,"time, android, update, platforms, problems, offline, audio, sweet, galaxy, rate","Busan, South Korea",male,2016-04-04
The best music player for Android. No doubts.,positivo,positivo,4,"android, curated, powerful, voice, commands, stable, regular, service, player, device","Johannesburg, South Africa",male,2016-08-17
Great app the sound quality is better than spotify,positivo,positivo,0,"time, android, update, platforms, problems, offline, audio, sweet, galaxy, rate","Houston, United States",male,2016-10-10
"All of my music in one place. Thank you, Apple, for having almost everything available and making the app functional, approachable, and packed with features. Love it.",positivo,positivo,2,"audio, lossless, atmos, dolby, lyrics, options, hires, feature, india, spatial","Prague, Czech Republic",male,2015-10-07
"Constant feed of high quality music on demand anytime, almost anywhere, lossless audio, let's me see what my friends are listening to, It's pretty good. A few songs aren't on there because of licensing issues though.",positivo,positivo,3,"search, specific, problem, download, option, phone, bugs, trial, edit, pixel","Seville, Spain",male,2015-10-11
I collected music to store on my analog tapes.,positivo,positivo,0,"time, android, update, platforms, problems, offline, audio, sweet, galaxy, rate","Calgary, Canada",male,2016-11-05
Much has changed and improved since it first came out. Love it so far.,positivo,positivo,0,"time, android, update, platforms, problems, offline, audio, sweet, galaxy, rate","Seoul, South Korea",male,2016-03-30
"If you are a spotify user,you need to try to change to apple music because it sounds more better.After changing to apple music,I can't go back to spotify :)",positivo,positivo,0,"time, android, update, platforms, problems, offline, audio, sweet, galaxy, rate","Edinburgh, United Kingdom",male,2015-08-11
The downloaded music does not play on android 9. I don't have the have the same problem with youtube music nor spotify.,positivo,positivo,0,"time, android, update, platforms, problems, offline, audio, sweet, galaxy, rate","Dubai, United Arab Emirates",male,2016-04-09
"Love the Apple Lossless audio codec. The sound quality is absolutely amazing. Thank you, Apple, for a wonderful product.",positivo,positivo,2,"audio, lossless, atmos, dolby, lyrics, options, hires, feature, india, spatial","Washington DC, United States",female,2017-09-17
"Amazing audio quality, amazing playlist selection, amazing player ui! The personal music mixes are on spot for me, and the curated playlists are top notch. Far better than the competition imo.",positivo,positivo,0,"time, android, update, platforms, problems, offline, audio, sweet, galaxy, rate","Ottawa, Canada",male,2016-12-07
This app helps you to make download music in any language this is why it's better to use this one not those on playstore,positivo,positivo,5,"platform, algorithm, didnt, service, clear, podcasts, issue, android, choice, audio","Lisbon, Portugal",male,2015-09-22
Top quality sound output and subscription charges are affordable compared to other platforms,positivo,positivo,5,"platform, algorithm, didnt, service, clear, podcasts, issue, android, choice, audio","Port Moresby, Papua New Guinea",female,2018-04-20
Scroll bar keeps being added and removed. Takes forever to get to my most recent added song in my playlists. I'll give 5 stars again once it's added back. Smh,positivo,positivo,0,"time, android, update, platforms, problems, offline, audio, sweet, galaxy, rate","Medellín, Colombia",female,2018-02-09
"I dumped Spotify for Apple Music after yet another price hike and don't regret it. It does everything Spotify does and I think the recommendations are better. There's a cheap app that can import your Spotify playlists to Apple Music, so there's really no excuse.",positivo,positivo,6,"phone, account, android, selection, samsung, product, smooth, products, video, recommendation","Pretoria, South Africa",male,2016-09-02
Apple Music is way better than Spotify when it comes to song recos and algorithm.,positivo,positivo,5,"platform, algorithm, didnt, service, clear, podcasts, issue, android, choice, audio","Geneva, Switzerland",male,2015-08-08
I couldn't log in on my Android phone After i put in my apple id nothing happens You guys need to do something about this,positivo,positivo,6,"phone, account, android, selection, samsung, product, smooth, products, video, recommendation","Adelaide, Australia",female,2018-07-12
"great app experience, smooth animations, quick and snappy interactions.",positivo,positivo,6,"phone, account, android, selection, samsung, product, smooth, products, video, recommendation","Guangzhou, China",male,2016-03-20
can you make it able to share songs on Instagram?,positivo,positivo,5,"platform, algorithm, didnt, service, clear, podcasts, issue, android, choice, audio","Asunción, Paraguay",female,2018-02-14
"Not showing lengths; inconvenient queue; lags; offline can't go to from a song to the artist; constantly asking whether I want to clear the queue (who's idea was that?); search button works like ""back"" from previous search, so you have to push it 4 times (whyyy)... The app feels like an unfinished project by uni students. Yet all the alternatives are much, much worse. This is actually the only music app that does not lack some vital feature. So, highly recommended, faute de mieux.",positivo,positivo,5,"platform, algorithm, didnt, service, clear, podcasts, issue, android, choice, audio","Tokyo, Japan",male,2016-01-18
One of the best apps ! Glad they put this platform on android as well because i switched. Happy customer!,positivo,positivo,4,"android, curated, powerful, voice, commands, stable, regular, service, player, device","Hamburg, Germany",male,2015-09-09
