review,sentiment,Polaridad_Clustering,Topic_ID,Palabras_Clave,location,gender,date
"In my experience, search works well when looking for specific songs. It makes the experience better overall.",positivo,positivo,3,"search, specific, problem, download, option, phone, bugs, trial, edit, pixel","Houston, United States",male,2016-11-29
One thing I like is that the app feels stable during regular use. It definitely stands out.,positivo,positivo,4,"android, curated, powerful, voice, commands, stable, regular, service, player, device","Durban, South Africa",male,2016-07-27
"Personally, it works smoothly with Siri and voice commands. It makes the experience better overall.",positivo,positivo,4,"android, curated, powerful, voice, commands, stable, regular, service, player, device","Lusaka, Zambia",male,2016-04-29
"Honestly, my music library syncs seamlessly across my devices.",positivo,positivo,1,"devices, interface, syncs, clean, mixes, suggestions, user, personalized, android, enjoyable","Algiers, Algeria",male,2016-05-28
"So far, audio quality sounds excellent. It makes the experience better overall.",positivo,positivo,2,"audio, lossless, atmos, dolby, lyrics, options, hires, feature, india, spatial","Jerusalem, Israel",male,2016-02-15
"For me, i like the curated playlists and radio stations.",positivo,positivo,4,"android, curated, powerful, voice, commands, stable, regular, service, player, device","Calgary, Canada",male,2017-05-02
"For me, the app feels stable during regular use. It works really well for me.",positivo,positivo,4,"android, curated, powerful, voice, commands, stable, regular, service, player, device","Budapest, Hungary",male,2015-10-05
The best part is that i enjoy the personalized mixes and suggestions. It adds to the overall experience.,positivo,positivo,1,"devices, interface, syncs, clean, mixes, suggestions, user, personalized, android, enjoyable","Austin, United States",male,2016-09-23
"Personally, it works smoothly with Siri and voice commands. It works really well for me.",positivo,positivo,4,"android, curated, powerful, voice, commands, stable, regular, service, player, device","Suva, Fiji",female,2018-06-24
"So far, i like the curated playlists and radio stations. It adds to the overall experience.",positivo,positivo,4,"android, curated, powerful, voice, commands, stable, regular, service, player, device","Harare, Zimbabwe",male,2016-06-11
"In my experience, it integrates perfectly with my Apple devices. It makes the experience better overall.",positivo,positivo,1,"devices, interface, syncs, clean, mixes, suggestions, user, personalized, android, enjoyable","Addis Ababa, Ethiopia",male,2016-07-28
"For me, the app feels stable during regular use.",positivo,positivo,4,"android, curated, powerful, voice, commands, stable, regular, service, player, device","Dallas, United States",male,2016-11-01
"Personally, i enjoy the personalized mixes and suggestions. It makes listening more enjoyable.",positivo,positivo,1,"devices, interface, syncs, clean, mixes, suggestions, user, personalized, android, enjoyable","Brasília, Brazil",female,2018-01-03
"Personally, it works smoothly with Siri and voice commands.",positivo,positivo,4,"android, curated, powerful, voice, commands, stable, regular, service, player, device","Windhoek, Namibia",male,2016-07-27
"So far, my music library syncs seamlessly across my devices. It works really well for me.",positivo,positivo,1,"devices, interface, syncs, clean, mixes, suggestions, user, personalized, android, enjoyable","Barcelona, Spain",male,2015-07-18
The best part is that audio quality sounds excellent. It adds to the overall experience.,positivo,positivo,2,"audio, lossless, atmos, dolby, lyrics, options, hires, feature, india, spatial","Shanghai, China",male,2016-02-08
"Personally, i like the curated playlists and radio stations. It makes listening more enjoyable.",positivo,positivo,4,"android, curated, powerful, voice, commands, stable, regular, service, player, device","Delhi, India",male,2016-02-19
What stands out is that managing my library feels powerful once you get used to it. It keeps things simple.,positivo,positivo,4,"android, curated, powerful, voice, commands, stable, regular, service, player, device","La Paz, Bolivia",female,2018-02-03
"So far, the app feels stable during regular use. It works really well for me.",positivo,positivo,4,"android, curated, powerful, voice, commands, stable, regular, service, player, device","Denver, United States",male,2016-12-01
"In my experience, i enjoy the personalized mixes and suggestions. It makes listening more enjoyable.",positivo,positivo,1,"devices, interface, syncs, clean, mixes, suggestions, user, personalized, android, enjoyable","Melbourne, Australia",female,2018-08-23
"Honestly, it works smoothly with Siri and voice commands.",positivo,positivo,4,"android, curated, powerful, voice, commands, stable, regular, service, player, device","Ottawa, Canada",female,2017-08-03
listening to music never been so good since the time of CD..,positivo,positivo,0,"time, android, update, platforms, problems, offline, audio, sweet, galaxy, rate","Calgary, Canada",male,2017-03-26
So nice to me I don't know about you,positivo,positivo,0,"time, android, update, platforms, problems, offline, audio, sweet, galaxy, rate","New York, United States",male,2016-12-04
1 month free just 1 month free then pay not bad,positivo,positivo,0,"time, android, update, platforms, problems, offline, audio, sweet, galaxy, rate","Vancouver, Canada",male,2016-10-28
Exceptional audio quality with all kinds of songs,positivo,positivo,2,"audio, lossless, atmos, dolby, lyrics, options, hires, feature, india, spatial","Cancun, Mexico",male,2016-11-13
Pls Improve library updating without changing my downloads to not available in your region.,positivo,positivo,0,"time, android, update, platforms, problems, offline, audio, sweet, galaxy, rate","Stockholm, Sweden",male,2015-10-16
Everything is awesome but launch apple tv on play store,positivo,positivo,6,"phone, account, android, selection, samsung, product, smooth, products, video, recommendation","New York, United States",male,2016-12-25
It was amazing I loved this app and I hope you will to,positivo,positivo,0,"time, android, update, platforms, problems, offline, audio, sweet, galaxy, rate","Chennai, India",male,2016-03-28
Brilliant sound quality! All songs hit me the right way every-single-time.,positivo,positivo,0,"time, android, update, platforms, problems, offline, audio, sweet, galaxy, rate","Chicago, United States",female,2017-09-25
It's a very good app but it takes up too much space,positivo,positivo,3,"search, specific, problem, download, option, phone, bugs, trial, edit, pixel","Christchurch, New Zealand",female,2018-04-01
This is the best music streaming app I have tried.,positivo,positivo,0,"time, android, update, platforms, problems, offline, audio, sweet, galaxy, rate","Melbourne, Australia",female,2018-06-03
I needa nother free trial fo my review,positivo,positivo,3,"search, specific, problem, download, option, phone, bugs, trial, edit, pixel","Rabat, Morocco",male,2016-06-02
always try using lossless switch on and the experience is just WOW. And just for FYI I downloaded the app for the same. Simply 5*,positivo,positivo,2,"audio, lossless, atmos, dolby, lyrics, options, hires, feature, india, spatial","Munich, Germany",male,2015-09-28
Love this music service but wish it had a watch app.,positivo,positivo,4,"android, curated, powerful, voice, commands, stable, regular, service, player, device","Melbourne, Australia",female,2018-07-14
Love the experience of apple music. So much music and the sound quality is great. I have no bad experience using the app.,positivo,positivo,0,"time, android, update, platforms, problems, offline, audio, sweet, galaxy, rate","Mexico City, Mexico",female,2017-11-01
We really love like this app but can you make some of the music free for people that cannot afford payment thanks listening to my review,positivo,positivo,3,"search, specific, problem, download, option, phone, bugs, trial, edit, pixel","Harare, Zimbabwe",male,2016-07-26
Easy to use a the letters in song lyrics do move.,positivo,positivo,2,"audio, lossless, atmos, dolby, lyrics, options, hires, feature, india, spatial","Hobart, Australia",female,2018-06-13
"Sound quality is better than Spotify by alot, appreciate it",positivo,positivo,0,"time, android, update, platforms, problems, offline, audio, sweet, galaxy, rate","Dakar, Senegal",male,2016-05-22
"Absolutely love it, and the quality of the music is definitely unmatched especially when listening with air podso in the car",positivo,positivo,5,"platform, algorithm, didnt, service, clear, podcasts, issue, android, choice, audio","Abuja, Nigeria",male,2016-04-21
"The best music app ever, only issue is the shuffle algorithm is the worst on this. But the music quality is top class.",positivo,positivo,5,"platform, algorithm, didnt, service, clear, podcasts, issue, android, choice, audio","Paris, France",male,2015-09-25
Apple music is the most music exciting platform ever,positivo,positivo,5,"platform, algorithm, didnt, service, clear, podcasts, issue, android, choice, audio","Philadelphia, United States",female,2017-08-02
"When I had iPhones this was my go-to music listening app. I love all of their special playlists and currated mixes. I miss my iPhone. Wish people weren't such lint licking, walking farther, theives....I'd still have all ofy iOS software if it weren't for greedy, soulless, sediment-guzzling meanies.",positivo,positivo,1,"devices, interface, syncs, clean, mixes, suggestions, user, personalized, android, enjoyable","Adelaide, Australia",female,2018-05-14
It has some bugs and lags but overall I am very satisfied with music quality. Interface is simple and useful. Definitely the best of all other music streaming services for me.,positivo,positivo,5,"platform, algorithm, didnt, service, clear, podcasts, issue, android, choice, audio","Pretoria, South Africa",male,2016-07-17
Is so great and good for me using it for me to get a new song,positivo,positivo,0,"time, android, update, platforms, problems, offline, audio, sweet, galaxy, rate","San Diego, United States",female,2017-08-23
live this Damn app it's Awesome I've used Utube music Spotify Pandora on and on back to lime wire pro But this Apple music App is BBLLEEPPIINNGG AWESOME would recommend it to everybody who lives music and the ease and precision of Apple so the the saying is An apple a day keeps the doctor away in the case it keeps the dear doctor feeling lively and energetic the mood balanced & robust sprinkled with some doctor feel good beats at the ease of my fingertips thank you apple,positivo,positivo,3,"search, specific, problem, download, option, phone, bugs, trial, edit, pixel","Córdoba, Argentina",female,2017-12-12
"Excellent music app, selection of music is awesome, love the integration with itunes.",positivo,positivo,6,"phone, account, android, selection, samsung, product, smooth, products, video, recommendation","Harare, Zimbabwe",male,2016-07-31
Glad. To have it for android where i can use my account to listen. I prefer apple music where the artist is rewarded justly,positivo,positivo,6,"phone, account, android, selection, samsung, product, smooth, products, video, recommendation","Montreal, Canada",male,2016-09-20
"I love apple music , I have no issues with it.",positivo,positivo,6,"phone, account, android, selection, samsung, product, smooth, products, video, recommendation","Casablanca, Morocco",male,2016-07-27
The comparison between Spotify and Apple Music is the audio quality. I was so surprised when I started my 1 month free trial and when I tune up my music in earphones the audio is so crisp and those bass are banging. I love it.,positivo,positivo,2,"audio, lossless, atmos, dolby, lyrics, options, hires, feature, india, spatial","Seattle, United States",male,2016-12-22
Very clear reception music I love very much.,positivo,positivo,5,"platform, algorithm, didnt, service, clear, podcasts, issue, android, choice, audio","Vancouver, Canada",female,2017-08-24
Recently switched to Apple Music and I can definitely feel the change in quality,positivo,positivo,4,"android, curated, powerful, voice, commands, stable, regular, service, player, device","Phoenix, United States",male,2017-06-25
suggested music is little pay pushy but not bad,positivo,positivo,0,"time, android, update, platforms, problems, offline, audio, sweet, galaxy, rate","Prague, Czech Republic",male,2015-10-13
I'm going to give you 10 thanks a lot for this app,positivo,positivo,0,"time, android, update, platforms, problems, offline, audio, sweet, galaxy, rate","Santa Cruz, Bolivia",female,2018-01-08
My app does not have the option to be cancelled and I can not find it in playstore. I also contacted appled but they can not cancel it too.,positivo,positivo,5,"platform, algorithm, didnt, service, clear, podcasts, issue, android, choice, audio","Santa Cruz, Bolivia",female,2018-03-26
"Even if it's Apple, it's a must have for melomaniacs",positivo,positivo,0,"time, android, update, platforms, problems, offline, audio, sweet, galaxy, rate","Montevideo, Uruguay",female,2017-12-09
Its really cool and you lisen to what ever u want,positivo,positivo,0,"time, android, update, platforms, problems, offline, audio, sweet, galaxy, rate","Durban, South Africa",male,2016-05-26
It's good but I hate when it skips my fav songs and goes to a song I don't really like,positivo,positivo,3,"search, specific, problem, download, option, phone, bugs, trial, edit, pixel","Calgary, Canada",female,2017-10-08
I will like to be hearing all my favorite songs here,positivo,positivo,0,"time, android, update, platforms, problems, offline, audio, sweet, galaxy, rate","Austin, United States",female,2017-08-11
Good playlists that are already made and available to use. No adds if you buy the Apple Music app subscription that's $10.99 a month it's better than Spotify imo. As long as you have an icloud account you can do a free trial. If not you can still download the Apple Music App and make an icloud account for free.,positivo,positivo,6,"phone, account, android, selection, samsung, product, smooth, products, video, recommendation","Caracas, Venezuela",female,2017-12-19
App is great but the library is small,positivo,positivo,4,"android, curated, powerful, voice, commands, stable, regular, service, player, device","Windhoek, Namibia",male,2016-06-15
It's is super great and it's a good app,positivo,positivo,0,"time, android, update, platforms, problems, offline, audio, sweet, galaxy, rate","Los Angeles, United States",female,2017-10-10
"""Apple Music is fantastic, but I'd love to see the lyrics sharing feature expand beyond just Instagram stories. It would be amazing to have the option to share lyrics on platforms like Snapchat as well. Please consider this for future updates!""",positivo,positivo,5,"platform, algorithm, didnt, service, clear, podcasts, issue, android, choice, audio","Tel Aviv, Israel",male,2016-01-27
"Apple music has come so far, now there are very few bugs, audio quality is best and ux is also great! I've switched from Spotify to apple music",positivo,positivo,3,"search, specific, problem, download, option, phone, bugs, trial, edit, pixel","Geneva, Switzerland",male,2015-08-24
Apple music is a great time to listen to relaxing music,positivo,positivo,0,"time, android, update, platforms, problems, offline, audio, sweet, galaxy, rate","Denver, United States",male,2017-01-12
"I am using it on S24 ultra, and it's working as normal as it would do on an IOS device. However, the Apple karaoke option is not available.",positivo,positivo,4,"android, curated, powerful, voice, commands, stable, regular, service, player, device","Monterrey, Mexico",male,2017-04-19
"It's alright surprisingly, not a lot of music tracks. Or any other added songs. But it's not bad, average or awful just alright.",positivo,positivo,0,"time, android, update, platforms, problems, offline, audio, sweet, galaxy, rate","Busan, South Korea",male,2016-01-31
Good stand up comedy as well as good music.,positivo,positivo,0,"time, android, update, platforms, problems, offline, audio, sweet, galaxy, rate","Amsterdam, Netherlands",male,2015-09-16
bad part is no free version but their paid version is not as expensive as Spotify,positivo,positivo,2,"audio, lossless, atmos, dolby, lyrics, options, hires, feature, india, spatial","Boston, United States",male,2017-01-13
"good music stream service, but when my phone had a catastrophic crash, and I had to reinstall apple on new phone, about 35~40% of my self created playlists were empty,.. the name and picture of the playlist were there, but when clicked on, absolutely empty. I carefully curated those lists, and had to start from scratch for many of them. it's a real first world problem, I know. but it was a real pain in the a$s. I reported it to Apple, no response at all, just an email to say they here me!",positivo,positivo,3,"search, specific, problem, download, option, phone, bugs, trial, edit, pixel","Athens, Greece",male,2015-08-09
"I love this app, especially the discount for students.",positivo,positivo,2,"audio, lossless, atmos, dolby, lyrics, options, hires, feature, india, spatial","Chicago, United States",male,2017-06-16
"Been loving this app since 2018, always new and fun updates. Loved lossless, loved the addition of lyrics and loving full screen art work. Dressed to impress and always done well. The apple way.",positivo,positivo,5,"platform, algorithm, didnt, service, clear, podcasts, issue, android, choice, audio","San Francisco, United States",female,2017-08-19
This very fantastic in other music app. I face some bugs in app. I think this bug will be solve.,positivo,positivo,3,"search, specific, problem, download, option, phone, bugs, trial, edit, pixel","Asunción, Paraguay",female,2018-03-17
just for flac high res lossless sound quality this deserves 5 star,positivo,positivo,6,"phone, account, android, selection, samsung, product, smooth, products, video, recommendation","Los Angeles, United States",female,2017-07-22
if your tired of listening to 15 songs in your 500 songs playlist on Spotify and wanna discover new music you'll like this is the app forsho,positivo,positivo,0,"time, android, update, platforms, problems, offline, audio, sweet, galaxy, rate","Washington DC, United States",male,2017-02-21
Best music app by far. Sound quality amazing and focussing purely on music with a great interface,positivo,positivo,1,"devices, interface, syncs, clean, mixes, suggestions, user, personalized, android, enjoyable","Accra, Ghana",male,2016-08-04
"i don't know why this app gets negative response, I have a mac and I subscribed apple music there and I linked my account to this app and everything is working as smooth as butter",positivo,positivo,6,"phone, account, android, selection, samsung, product, smooth, products, video, recommendation","Auckland, New Zealand",female,2018-07-22
"The music quality is fabulously great, you get hi res lossless audio quality if you have a DAC",positivo,positivo,2,"audio, lossless, atmos, dolby, lyrics, options, hires, feature, india, spatial","San Francisco, United States",female,2017-09-26
Works like a charm. Tried that other green one but this one is always better,positivo,positivo,0,"time, android, update, platforms, problems, offline, audio, sweet, galaxy, rate","Melbourne, Australia",female,2018-08-10
No folding display support means a completely broken experience on devices like the Fold. Edit September 2023: the latest update fixed this. The app is now 5/5.,positivo,positivo,3,"search, specific, problem, download, option, phone, bugs, trial, edit, pixel","Shanghai, China",male,2016-01-30
Works really good even on a samung phone. Love samsung for their phones but apple music is the best,positivo,positivo,6,"phone, account, android, selection, samsung, product, smooth, products, video, recommendation","Canberra, Australia",female,2018-08-11
Apple music on Android with high quality music,positivo,positivo,4,"android, curated, powerful, voice, commands, stable, regular, service, player, device","Mexico City, Mexico",male,2016-11-12
"Selection is great, works great just as if I had Spotify premium",positivo,positivo,6,"phone, account, android, selection, samsung, product, smooth, products, video, recommendation","Seattle, United States",male,2017-03-06
"a repeat tool would be useful. But then if you know what you want to listen to this is good. There are some songs Apple does not have that are on Spotify, so missing those, but then there's stuff on Apple that's not on Spotify. The radios are a little finicky, but overall a good app.",positivo,positivo,0,"time, android, update, platforms, problems, offline, audio, sweet, galaxy, rate","Manila, Philippines",male,2016-04-16
Best music app for lossless audiophile like me.,positivo,positivo,0,"time, android, update, platforms, problems, offline, audio, sweet, galaxy, rate","Quito, Ecuador",female,2018-02-08
"It is good app, but there issue in Andriod App. There is not sound check option in app, and due to this sound volume lowers when using with cable in Car Andriod Auto.",positivo,positivo,1,"devices, interface, syncs, clean, mixes, suggestions, user, personalized, android, enjoyable","Quebec City, Canada",male,2017-03-16
really good grove alt indie music. check them out.,positivo,positivo,0,"time, android, update, platforms, problems, offline, audio, sweet, galaxy, rate","Vancouver, Canada",female,2017-08-31
Been a customer for years I love this app,positivo,positivo,4,"android, curated, powerful, voice, commands, stable, regular, service, player, device","Chicago, United States",male,2017-02-13
Nise music and free to play the music,positivo,positivo,0,"time, android, update, platforms, problems, offline, audio, sweet, galaxy, rate","Santiago, Chile",female,2017-12-16
Sound Quality is probably the best on Android. The only reason I haven't given up Spotify is because the radio station creation and AI DJ is unparalleled. making it easier to discover new songs and artists that I'll probably like,positivo,positivo,4,"android, curated, powerful, voice, commands, stable, regular, service, player, device","Hobart, Australia",female,2018-06-07
it's my favorite music app i love it,positivo,positivo,0,"time, android, update, platforms, problems, offline, audio, sweet, galaxy, rate","Tijuana, Mexico",male,2016-10-12
u good bro..no troubles at all..just sometimes take it easy when it's time to recover the account ..I love u apple ..always will,positivo,positivo,6,"phone, account, android, selection, samsung, product, smooth, products, video, recommendation","Philadelphia, United States",female,2017-09-03
"This Album is a Must, soundtrack of a lost generation",positivo,positivo,5,"platform, algorithm, didnt, service, clear, podcasts, issue, android, choice, audio","Vancouver, Canada",male,2016-10-12
I never tried out this app but I think I like it,positivo,positivo,0,"time, android, update, platforms, problems, offline, audio, sweet, galaxy, rate","Montevideo, Uruguay",female,2017-11-24
"Apple music is all that I will use I have tried other apps previously, they kept losing licenses for bands I would listen to and apple does not. Easiest navigation through the app",positivo,positivo,3,"search, specific, problem, download, option, phone, bugs, trial, edit, pixel","Seoul, South Korea",male,2016-01-08
just be more creative with the ui. the services are top notch though. there's not enough customization options,positivo,positivo,2,"audio, lossless, atmos, dolby, lyrics, options, hires, feature, india, spatial","Denver, United States",female,2017-09-17
Amazing sound visuals top tier. Dolby atmos is literally life changing! Been using AM for a year and half now never thought of giving it up unless i'm using the windows version but that's a whole diff convo lol! 10/10,positivo,positivo,6,"phone, account, android, selection, samsung, product, smooth, products, video, recommendation","Austin, United States",male,2017-03-23
This is just what i need it helps me to play my music without any mistake,positivo,positivo,4,"android, curated, powerful, voice, commands, stable, regular, service, player, device","San Francisco, United States",male,2017-01-30
"I use this app on my iPhone and Android device, I love it! Is the best streaming service ever!",positivo,positivo,4,"android, curated, powerful, voice, commands, stable, regular, service, player, device","Toronto, Canada",male,2016-10-14
Easy to find the music I like and this app is actually worth the money that I am spending on it. I don't have the app freezing on me or constantly saying that it's buffering. I like the music chooses in the playlists that are provided. Thanks for making this app .I can come back to it time and time again and still enjoy it.,positivo,positivo,0,"time, android, update, platforms, problems, offline, audio, sweet, galaxy, rate","Lisbon, Portugal",male,2015-07-22
This app has works fantastic on my Galaxy S23. There are no issues as of yet. I think Apple Music gives you the biggest bang for your buck if you are looking for better hi res sound.,positivo,positivo,5,"platform, algorithm, didnt, service, clear, podcasts, issue, android, choice, audio","Monterrey, Mexico",male,2017-05-19
great app father off all music streaming app,positivo,positivo,4,"android, curated, powerful, voice, commands, stable, regular, service, player, device","Canberra, Australia",female,2018-06-23
It's awesome very convenient and I have found every song that I was looking for.,positivo,positivo,3,"search, specific, problem, download, option, phone, bugs, trial, edit, pixel","Wellington, New Zealand",female,2018-07-06
I love my music sound with this app,positivo,positivo,0,"time, android, update, platforms, problems, offline, audio, sweet, galaxy, rate","Boston, United States",male,2017-06-12
