review,sentiment,Polaridad_Clustering,Topic_ID,Palabras_Clave,location,gender,date
"I uses it recently through headphones and home theatre , lossless music streaming is very efficient and it's take me to actual studio room effects DD dolby and equalizer are perfectly support to apple music ,21st century feeling ...Awesome",positivo,positivo,3,"search, specific, problem, download, option, phone, bugs, trial, edit, pixel","Vancouver, Canada",female,2017-08-31
"I use both apple music and spotify and apple music is 100 times better, yes more pricey but still better than whatever spotify is doing",positivo,positivo,0,"time, android, update, platforms, problems, offline, audio, sweet, galaxy, rate","Queenstown, New Zealand",female,2018-05-22
Only streaming service to give hi res lossless music.,positivo,positivo,2,"audio, lossless, atmos, dolby, lyrics, options, hires, feature, india, spatial","Port Moresby, Papua New Guinea",female,2018-05-04
I'm an android owner who recently began to use apple music because of a free trail I obtained by purchasing new Beats headphones & let me say that I love it. I am a convert! It makes YouTube music sound pathetic. Highly recommend!,positivo,positivo,6,"phone, account, android, selection, samsung, product, smooth, products, video, recommendation","Taipei, Taiwan",male,2015-12-24
Sound quality is better with Apple music. Yes I said it. I love android but they need work in the audio department. Switch from iPhone 14 pro max to Galaxy S25 Ultra. Love android but can't do without apple music.,positivo,positivo,0,"time, android, update, platforms, problems, offline, audio, sweet, galaxy, rate","Tokyo, Japan",male,2016-02-12
Best high quality songs you can get including lossless and Dolby Atmos,positivo,positivo,2,"audio, lossless, atmos, dolby, lyrics, options, hires, feature, india, spatial","Nadi, Fiji",female,2018-04-10
I want the series on my phone up with you my sexy black women and I am very happy for you my sexy black lady,positivo,positivo,6,"phone, account, android, selection, samsung, product, smooth, products, video, recommendation","Washington DC, United States",male,2017-04-12
"I like apple music app, iphone not so much. How can i get it on android?",positivo,positivo,4,"android, curated, powerful, voice, commands, stable, regular, service, player, device","Berlin, Germany",male,2015-07-13
"I have had Apple Music since May of '16 and I have never thought about going thru any other stream service, love it!!",positivo,positivo,2,"audio, lossless, atmos, dolby, lyrics, options, hires, feature, india, spatial","San Antonio, United States",male,2017-04-25
So you know this app is very easy to use and get to know so very well it's almost slippery. Like you'll find it's going so well it's almost slippery and you have to slow down to catch everything. Best to use hands down!,positivo,positivo,0,"time, android, update, platforms, problems, offline, audio, sweet, galaxy, rate","San Antonio, United States",female,2017-10-02
"The service is good but, the interface freezes a lot. edit: it's better now. the app works really good. there is a delay when a song is selected to play. but that is something i have observed on apple devices too. so that is a service related issue and not specific to this app",positivo,positivo,3,"search, specific, problem, download, option, phone, bugs, trial, edit, pixel","Krakow, Poland",male,2015-08-20
It is good and clear when listnening to music,positivo,positivo,5,"platform, algorithm, didnt, service, clear, podcasts, issue, android, choice, audio","Cancun, Mexico",male,2017-06-02
I like app it cool I try. Out. It cool music I m very love music I give five star,positivo,positivo,0,"time, android, update, platforms, problems, offline, audio, sweet, galaxy, rate","Wellington, New Zealand",female,2018-06-11
Honestly it's nice and it's easy to download songs,positivo,positivo,0,"time, android, update, platforms, problems, offline, audio, sweet, galaxy, rate","Santiago, Chile",female,2018-01-15
I love it because there is no ads and you can get it free for $0 for 3months then pay but I love it,positivo,positivo,0,"time, android, update, platforms, problems, offline, audio, sweet, galaxy, rate","Perth, Australia",female,2018-07-08
"I like that I use the app, although I do not have an iPhone. I like that I have control of what I want to listen to. it's not overwhelming. I also like the variety of options.",positivo,positivo,2,"audio, lossless, atmos, dolby, lyrics, options, hires, feature, india, spatial","Jacksonville, United States",male,2016-10-07
besttt worth forr money better that all the music player,positivo,positivo,0,"time, android, update, platforms, problems, offline, audio, sweet, galaxy, rate","Queenstown, New Zealand",female,2018-07-13
"Of all the hi-res music streaming services out there (Tidal, Qobuz, Amazon), Apple Music is the winner for me. Most polished user experience and one of the best algorithms for recommending new music. It is easy to navigate and works very reliably even on Android. Give it a try :)",positivo,positivo,3,"search, specific, problem, download, option, phone, bugs, trial, edit, pixel","Christchurch, New Zealand",female,2018-06-24
"I've tried several music apps and this is by far the best, and I'm using a Samsung..",positivo,positivo,1,"devices, interface, syncs, clean, mixes, suggestions, user, personalized, android, enjoyable","Guadalajara, Mexico",male,2017-04-16
is best is best all of others music player becose hi res audio support an I love this,positivo,positivo,1,"devices, interface, syncs, clean, mixes, suggestions, user, personalized, android, enjoyable","Warsaw, Poland",male,2015-10-11
"some friends say spotify, i have no idea about technicals but apple keeps it simple and their app is a gigiant compared to spotify",positivo,positivo,1,"devices, interface, syncs, clean, mixes, suggestions, user, personalized, android, enjoyable","São Paulo, Brazil",female,2017-11-11
Best quality music. First Lossless music stream in India and certainly It makes difference.,positivo,positivo,2,"audio, lossless, atmos, dolby, lyrics, options, hires, feature, india, spatial","Kuala Lumpur, Malaysia",male,2016-02-08
"OMG. To think I've been wasted my time on. Spotify. Let me start by saying ur crossfade feature is outstanding. I should know, I was an on the air talent at a radio stations for 7 years.. Also, I love the way it keeps track of how many songs, and total amount of hours . For me, that's terrific. I want to keep each playlist at 500 songs. The only thing u guys should work on is getting more options for each song. Keep up the good work.",positivo,positivo,2,"audio, lossless, atmos, dolby, lyrics, options, hires, feature, india, spatial","Austin, United States",male,2017-01-31
"SunithaThis update adds support for Autoplay on Chromecast devices, improved output device selection as well as fixes and performance enhancements.",positivo,positivo,0,"time, android, update, platforms, problems, offline, audio, sweet, galaxy, rate","Adelaide, Australia",female,2018-04-18
"The quality of the music is amazing, and some of the songs transition into the next and it sound like they go together. it amazing! 10.99 is worth it",positivo,positivo,1,"devices, interface, syncs, clean, mixes, suggestions, user, personalized, android, enjoyable","Cape Town, South Africa",male,2016-08-28
"I'm in the process of navigating over to Apple products, currently using a Macbook Pro for music and video production so thought I'd take advantage of the free trial. No problems running on Android and syncs well onto my Macbook. Easy to navigate around, add faves and build playlists. Pretty user friendly format and nothing too flashy.",positivo,positivo,6,"phone, account, android, selection, samsung, product, smooth, products, video, recommendation","Suva, Fiji",female,2018-07-24
Overall I like apple music because there's no ads like Spotify so it gets a 5 star,positivo,positivo,0,"time, android, update, platforms, problems, offline, audio, sweet, galaxy, rate","Philadelphia, United States",female,2017-09-05
I have an Android device and I still use Apple music for my music. love it,positivo,positivo,4,"android, curated, powerful, voice, commands, stable, regular, service, player, device","Montevideo, Uruguay",female,2017-12-12
"This application is exceptional. Its AI-powered music recommendations surpass those of Spotify, providing a seamless Android experience with superior sound quality and diverse radio stations. Initial concerns regarding Android compatibility, mirroring past experiences with iTunes on Windows, proved unfounded; the Android experience is comparable to the iOS version. Apple Fitness+ would be a welcome addition. Currently, it significantly outperforms all competing offerings on this platform.",positivo,positivo,5,"platform, algorithm, didnt, service, clear, podcasts, issue, android, choice, audio","Cancun, Mexico",male,2016-12-12
On Apple Music I can listen to all my favorite songs and I also get to listen to new music that I might like or not but there is over 2000 songs on Apple Music I only have like listened to 67 songs but I recommend you should try it.,positivo,positivo,0,"time, android, update, platforms, problems, offline, audio, sweet, galaxy, rate","Karachi, Pakistan",male,2015-12-29
Best music app ever especially dolby atmos with spatial audio,positivo,positivo,2,"audio, lossless, atmos, dolby, lyrics, options, hires, feature, india, spatial","Johannesburg, South Africa",male,2016-06-25
(2024 Update) previously 1 star. I use Apple music on my android and have for the past 5 years. After Google bought YouTube and ditched play music I jumped ship and went to this. The music recommendations are great. The sound quality is fantastic. I really enjoy the playlists that are generated every month and I especially love the playlist for the songs that I played the most from the previous year (replay). The cost is a bit steep but they all are. Glad I tried this platform again. 5 out of 5*,positivo,positivo,0,"time, android, update, platforms, problems, offline, audio, sweet, galaxy, rate","Tripoli, Libya",male,2016-07-07
I need aissistabce eith my extra imac i received from aple whem They lost track of the imac,positivo,positivo,6,"phone, account, android, selection, samsung, product, smooth, products, video, recommendation","Mexico City, Mexico",male,2017-03-12
Didn't think it will be THIS good. Easily the best app out there throughout ecosystems,positivo,positivo,5,"platform, algorithm, didnt, service, clear, podcasts, issue, android, choice, audio","San Antonio, United States",male,2017-05-17
Good quality music. More libraries. Contents are good,positivo,positivo,5,"platform, algorithm, didnt, service, clear, podcasts, issue, android, choice, audio","Ottawa, Canada",male,2016-11-04
Best music app ever it is a different buy,positivo,positivo,0,"time, android, update, platforms, problems, offline, audio, sweet, galaxy, rate","Marrakesh, Morocco",male,2016-05-27
Haven't used it yet but it might be cool.,positivo,positivo,0,"time, android, update, platforms, problems, offline, audio, sweet, galaxy, rate","Guadalajara, Mexico",female,2017-08-01
Love the app.All this app needs is the ability to translate the lyrics of any song to any language.,positivo,positivo,2,"audio, lossless, atmos, dolby, lyrics, options, hires, feature, india, spatial","Quebec City, Canada",female,2017-08-15
I can't log on because it says my apple id for this subscription is already being used. I'm ss frustrated,positivo,positivo,0,"time, android, update, platforms, problems, offline, audio, sweet, galaxy, rate","Cairo, Egypt",male,2016-09-05
"I'm a musician, and I create music which has a presence on all of the major streaming platforms. I can attest to a certainty that, when I submit my music to the agency which handles distribution, I'm always concerned that the various streaming services add their own compression, EQ, and I cringe at how different my master recordings sound when they've been through that processing. Not with Apple Music. I'm consistently pleased with the audio fidelity, the accuracy when compared to my original.",positivo,positivo,2,"audio, lossless, atmos, dolby, lyrics, options, hires, feature, india, spatial","Hong Kong, China",male,2016-02-02
I love to listen to songs by my favorite artists,positivo,positivo,0,"time, android, update, platforms, problems, offline, audio, sweet, galaxy, rate","Frankfurt, Germany",male,2015-08-05
Absolutely love it mane.... anything from De La Soul to Lil Durk. I'm in music heaven here,positivo,positivo,0,"time, android, update, platforms, problems, offline, audio, sweet, galaxy, rate","Barcelona, Spain",male,2015-08-09
Apple music is the best platform for listening to music the thing that I don't like is that the price be too much for the subscription,positivo,positivo,5,"platform, algorithm, didnt, service, clear, podcasts, issue, android, choice, audio","Chicago, United States",male,2017-05-05
"Best quality Audio app, Android mobile payment option not easy ,",positivo,positivo,5,"platform, algorithm, didnt, service, clear, podcasts, issue, android, choice, audio","Durban, South Africa",male,2016-05-09
"same songs keep repeating many days, even when infinite station is created",positivo,positivo,2,"audio, lossless, atmos, dolby, lyrics, options, hires, feature, india, spatial","Brussels, Belgium",male,2015-10-24
To open this app it seames so compricated you decided to denie my pins all i put.,positivo,positivo,0,"time, android, update, platforms, problems, offline, audio, sweet, galaxy, rate","Perth, Australia",female,2018-07-30
There's no release year on songs were uploaded manually from Finder on my Mac. iOS and macOS are showing year info,positivo,positivo,0,"time, android, update, platforms, problems, offline, audio, sweet, galaxy, rate","Harare, Zimbabwe",male,2016-06-22
"I absolutely love it. allows me to play all of my apple music on all my devices, including my Google home system!! Well worth the price I pay for it!!!",positivo,positivo,1,"devices, interface, syncs, clean, mixes, suggestions, user, personalized, android, enjoyable","Arequipa, Peru",female,2018-01-19
I want to play the video but it refuses!,positivo,positivo,6,"phone, account, android, selection, samsung, product, smooth, products, video, recommendation","Lyon, France",male,2015-09-06
Thank you for the update on the day I get home from the hospital and I 66 8s so much great full to you.,positivo,positivo,0,"time, android, update, platforms, problems, offline, audio, sweet, galaxy, rate","San Antonio, United States",male,2017-04-24
perfect app no problems and has everything needed,positivo,positivo,0,"time, android, update, platforms, problems, offline, audio, sweet, galaxy, rate","New York, United States",male,2017-05-10
Amazing app! I already like how I can sign in with my apple ID and has my favorite songs to download with my apple subscription! This is way better than youtube music imo.,positivo,positivo,0,"time, android, update, platforms, problems, offline, audio, sweet, galaxy, rate","Rabat, Morocco",male,2016-05-22
Amazing I just love it very much I can share my music from devices finally they're coming together.,positivo,positivo,1,"devices, interface, syncs, clean, mixes, suggestions, user, personalized, android, enjoyable","Taipei, Taiwan",male,2016-03-19
It works great. it took me a while to get used to it.,positivo,positivo,0,"time, android, update, platforms, problems, offline, audio, sweet, galaxy, rate","Asunción, Paraguay",female,2018-03-17
Apple Music gives you the best quality lossless sound from your favorite artists and artists you have yet to discover!,positivo,positivo,2,"audio, lossless, atmos, dolby, lyrics, options, hires, feature, india, spatial","Helsinki, Finland",male,2015-08-07
very smooth interface and very flexibme queing options,positivo,positivo,2,"audio, lossless, atmos, dolby, lyrics, options, hires, feature, india, spatial","Harare, Zimbabwe",male,2016-08-17
Never fails to work! Just like my switch. Never jams!!!!,positivo,positivo,4,"android, curated, powerful, voice, commands, stable, regular, service, player, device","Kampala, Uganda",male,2016-08-15
Good music and no filters SUCK MY HEART,positivo,positivo,2,"audio, lossless, atmos, dolby, lyrics, options, hires, feature, india, spatial","Phuket, Thailand",male,2016-02-16
The best thing about Apple Music than its competitors is the audio of the music it sounds clear and crisp because of its lossless audio feature.,positivo,positivo,2,"audio, lossless, atmos, dolby, lyrics, options, hires, feature, india, spatial","Shenzhen, China",male,2015-12-24
Dopest music site if you enjoy by yourself as a connasieur type with your circles or small circles,positivo,positivo,0,"time, android, update, platforms, problems, offline, audio, sweet, galaxy, rate","Stockholm, Sweden",male,2015-08-09
Such a amazing one. Love the podcasts radio and even Apple music TV.,positivo,positivo,5,"platform, algorithm, didnt, service, clear, podcasts, issue, android, choice, audio","Busan, South Korea",male,2016-03-27
"This is the BEST music app I've ever used. Though it requires subscription to listen to music but, the subscription has a obvious reason! Lyrics are synced in perfect time and some songs has a different lyrics animation too. Music quality is super can be upgraded to Hi-Res Lossless (ALC up-to 24-bit/192 kHZ) [A 3 minute song will consume 145MB (approx.)] SHOULD TRY THIS ONCE!",positivo,positivo,1,"devices, interface, syncs, clean, mixes, suggestions, user, personalized, android, enjoyable","Vienna, Austria",male,2015-11-14
"I've been using for around a week and I'm experiencing no issues unlike I'm seeing in other comments. I've been using Spotify and I wanted to try something different so I bought Apple Music. It feels much better than Spotify. It's cleaner, smoother, and all around better. Might just make me buy an iPhone.",positivo,positivo,6,"phone, account, android, selection, samsung, product, smooth, products, video, recommendation","Beijing, China",male,2016-01-27
"Much better than it used to be, and somehow more functional than the iOS counterpart.",positivo,positivo,2,"audio, lossless, atmos, dolby, lyrics, options, hires, feature, india, spatial","Cairo, Egypt",male,2016-08-09
The best music app really the best UI,positivo,positivo,0,"time, android, update, platforms, problems, offline, audio, sweet, galaxy, rate","Tel Aviv, Israel",male,2016-03-29
"6 star. The shuffle algorithm is amazing now! I listen to a lot of genres and the new algorithm is much more than a simple randomizer, music is shuffle in a very coherent way now. Great work!",positivo,positivo,5,"platform, algorithm, didnt, service, clear, podcasts, issue, android, choice, audio","Washington DC, United States",female,2017-09-05
Best Ever! I Can Create My Pn Playlist,positivo,positivo,0,"time, android, update, platforms, problems, offline, audio, sweet, galaxy, rate","Port Moresby, Papua New Guinea",female,2018-08-04
Great music here on this app! I've tried them all and this is the best! Highly Recommended!,positivo,positivo,2,"audio, lossless, atmos, dolby, lyrics, options, hires, feature, india, spatial","Pretoria, South Africa",male,2016-06-03
It's an amazing app it's one of the best for me,positivo,positivo,0,"time, android, update, platforms, problems, offline, audio, sweet, galaxy, rate","Medellín, Colombia",female,2017-12-16
"Dear Apple Team, Apple Music provides an amazing and unmatched listening experience. I haven't found this level of quality on any other platform. It would be incredible to have an Apple Music app for Amazon Fire TV, allowing users to enjoy this experience seamlessly. Please consider adding support for Fire TV in future updates. Thank you!",positivo,positivo,5,"platform, algorithm, didnt, service, clear, podcasts, issue, android, choice, audio","Mexico City, Mexico",female,2017-07-05
I love this app you are able to use it offline and it has mostly all of the songs you need,positivo,positivo,0,"time, android, update, platforms, problems, offline, audio, sweet, galaxy, rate","Busan, South Korea",male,2016-03-08
"No words, just superb audio; no one beats Apple Music. Recent updates Android phones are very optimized now. Better than Spotify.",positivo,positivo,0,"time, android, update, platforms, problems, offline, audio, sweet, galaxy, rate","Stockholm, Sweden",male,2015-07-05
I love apple music. So glad it'd available for Android. Used to have Apple them switched it over.,positivo,positivo,4,"android, curated, powerful, voice, commands, stable, regular, service, player, device","Phoenix, United States",male,2017-01-17
issues with apple worst company there is along with verizon sry just my opinion,positivo,positivo,4,"android, curated, powerful, voice, commands, stable, regular, service, player, device","Auckland, New Zealand",female,2018-04-29
amazing app love the no commercials and endless songs I can create lists for and hear,positivo,positivo,3,"search, specific, problem, download, option, phone, bugs, trial, edit, pixel","Bogotá, Colombia",female,2018-01-03
It is the best thing to listen to music.,positivo,positivo,0,"time, android, update, platforms, problems, offline, audio, sweet, galaxy, rate","Zurich, Switzerland",male,2015-08-25
my experience was in the distance past im just returning but its always been reliable and am confident it will be so in current times,positivo,positivo,5,"platform, algorithm, didnt, service, clear, podcasts, issue, android, choice, audio","Bangkok, Thailand",male,2016-01-05
"I have tried every other app for music and trust me Apple music beats all of them in most aspects, It's really worth it, I can easily recommend it to anyone who wants to listen to some high quality music.",positivo,positivo,6,"phone, account, android, selection, samsung, product, smooth, products, video, recommendation","Brisbane, Australia",female,2018-04-19
"As Android is my second phone, I love listening to Apple Music on this phone while using my iOS device for phone calls and personal use.",positivo,positivo,3,"search, specific, problem, download, option, phone, bugs, trial, edit, pixel","Tijuana, Mexico",male,2017-06-08
this is a legit apple for ur best music,positivo,positivo,0,"time, android, update, platforms, problems, offline, audio, sweet, galaxy, rate","Busan, South Korea",male,2016-04-06
The best Music app a person can ask for,positivo,positivo,6,"phone, account, android, selection, samsung, product, smooth, products, video, recommendation","Washington DC, United States",female,2017-08-10
Peak sound quality!. really worth the money I'm really glad i made the switch from Spoty you know what mean.,positivo,positivo,6,"phone, account, android, selection, samsung, product, smooth, products, video, recommendation","Kampala, Uganda",male,2016-05-29
Absolutely amazing app sound quality is the best I heard I absolutely love how clean the app looks and the lyric screen is very satisfying to look at and the app in general looks really great,positivo,positivo,3,"search, specific, problem, download, option, phone, bugs, trial, edit, pixel","Brussels, Belgium",male,2015-07-24
What a good app am feeling the vibe,positivo,positivo,0,"time, android, update, platforms, problems, offline, audio, sweet, galaxy, rate","Prague, Czech Republic",male,2015-10-31
in my phone it's crash whenever i opne camera i am using s23 and it's have network problem it's show just loading.,positivo,positivo,3,"search, specific, problem, download, option, phone, bugs, trial, edit, pixel","Busan, South Korea",male,2015-12-08
great audio quality with lossless technology everything is good about this app,positivo,positivo,2,"audio, lossless, atmos, dolby, lyrics, options, hires, feature, india, spatial","Seattle, United States",female,2017-08-19
"Apart from adding payment methods and setting everything up, great experience till now. Unparalleled sound quality. Will update after a month of usage.",positivo,positivo,6,"phone, account, android, selection, samsung, product, smooth, products, video, recommendation","Durban, South Africa",male,2016-06-14
I love this app it has music a songs I did not think it would have I have all my music organized it's perfect worth every penny,positivo,positivo,4,"android, curated, powerful, voice, commands, stable, regular, service, player, device","Hobart, Australia",female,2018-05-18
Awsome app. I love that its avalable on samsumg too,positivo,positivo,0,"time, android, update, platforms, problems, offline, audio, sweet, galaxy, rate","Jacksonville, United States",female,2017-08-06
It is an excellent app with wide range of songs and playlists. The software is very well-integrated than Spotify and the sound quality is too good. I am very much satisfied with the app.(I don't have any experience about subscriptions as I don't do it here. I manage it from my iPad app which has the same account).,positivo,positivo,0,"time, android, update, platforms, problems, offline, audio, sweet, galaxy, rate","Dubai, United Arab Emirates",male,2015-12-19
Awesome! Made transition from ios to Android a lot easier,positivo,positivo,1,"devices, interface, syncs, clean, mixes, suggestions, user, personalized, android, enjoyable","Cairo, Egypt",male,2016-09-03
all I know is Apple music has been good and the best to me since 2020,positivo,positivo,0,"time, android, update, platforms, problems, offline, audio, sweet, galaxy, rate","Vancouver, Canada",male,2017-01-08
